{
  "id": "precise-striker",
  "name": "Precise Striker",
  "source": "tanares",
  "status": {
    "provisoire": true,
    "raison": "capacite d'une classe simplifiee du Player's Guide to Tanares (Scoundrel), provisoire comme sa classe tant que le systeme complet de classes n'est pas livre",
    "retraitSi": "les classes simplifiees qui la nomment sont retirees (leur propre critere) et aucune donnee definitive ne la reference"
  },
  "effects": [
    {
      "kind": "attack-bonus",
      "value": 1
    }
  ],
  "text": "Player's Guide to Tanares, p. 206. +1 aux jets d'attaque (+2 au niveau 11, +3 au 17)."
}
