{
  "id": "hit-the-mark",
  "name": "Hit the Mark",
  "source": "tanares",
  "status": {
    "provisoire": true,
    "raison": "capacite d'une classe simplifiee du Player's Guide to Tanares (Brawler), provisoire comme sa classe tant que le systeme complet de classes n'est pas livre",
    "retraitSi": "les classes simplifiees qui la nomment sont retirees (leur propre critere) et aucune donnee definitive ne la reference"
  },
  "effects": [
    {
      "kind": "attack-bonus",
      "value": 2
    }
  ],
  "text": "Player's Guide to Tanares, p. 193. +2 aux jets d'attaque (+3 au niveau 9 et +4 au niveau 13, par Hit the Mark Improvement)."
}
